{
  "generated_at": "2026-04-19T15:00:00Z",
  "schema_version": "1.0.0",
  "artifact": "CRITIQUE_RESULT",
  "subject": "shared foundation validation bundle",
  "review_scope": "schemas, samples, validators, templates, README",
  "verdict": "pass",
  "findings": [
    {
      "severity": "Info",
      "message": "The new shared surfaces stay minimal and validator-friendly.",
      "evidence": "Each schema requires only the fields needed for the shared foundation contract.",
      "recommendation": "Keep any richer downstream semantics in consumer repos."
    }
  ],
  "repair_guidance": null,
  "bounded_non_claims": [
    "This critique result does not claim cross-repo adoption beyond the shared repo-agent-core surface."
  ]
}
